{
  "$schema": "https://json-schema.org/draft/2020-12/schema",
  "$id": "https://agentforge-3-redteam.internal/contracts/v1/vuln_report.schema.json",
  "title": "VulnReport",
  "description": "Documentation Agent -> human approval gate (docs/ARCHITECTURE.md §2/§3(4)): structured vulnerability report. Critical severity forces requires_human_gate=true, backing 'nothing critical self-publishes.'",
  "type": "object",
  "additionalProperties": false,
  "required": [
    "schema_version",
    "report_id",
    "exploit_id",
    "severity",
    "clinical_impact",
    "observed",
    "expected",
    "remediation",
    "fix_validation_status",
    "requires_human_gate",
    "filed_at"
  ],
  "properties": {
    "schema_version": { "const": "1.0.0" },
    "report_id": { "type": "string", "pattern": "^VULN-[0-9]{4,}$" },
    "exploit_id": { "type": "string", "pattern": "^EXP-[0-9]{4,}$" },
    "severity": { "enum": ["critical", "high", "medium", "low"] },
    "clinical_impact": { "type": "string", "minLength": 1 },
    "observed": { "type": "string", "minLength": 1 },
    "expected": { "type": "string", "minLength": 1 },
    "remediation": { "type": "string", "minLength": 1 },
    "fix_validation_status": { "enum": ["not_validated", "validated", "regressed"] },
    "requires_human_gate": { "type": "boolean" },
    "filed_at": { "type": "string", "format": "date-time" },
    "approved_at": { "type": "string", "format": "date-time" },
    "approved_by": { "type": "string", "minLength": 1 },
    "recording_ref": {
      "type": "string",
      "pattern": "^evals/recordings/[a-z0-9][a-z0-9-]*/$",
      "description": "Optional (issue #77/P3.36). Directory under evals/recordings/ (trailing slash, no filename) containing the committed, replayable draw(s) that back this report -- the report's own pointer to its evidence, so a reader does not have to cross-reference docs/ATO_EVIDENCE_PACKET.md §5.2 to find it. Deliberately a directory, not a single draw file: build_vuln_report() derives it from the source exploit_record's case_id (evals/recordings/<case_id>/), matching the convention every case's recordings already follow (see tools/build_vuln_reports.py::_load_recordings). Computed by build_vuln_report(), never hand-typed -- see redteam/agents/documentation.py. The single-segment charset is deliberately narrow (lowercase alphanumeric + hyphens, matching every real case_id in this repo) rather than the more permissive '[^/]+' a first pass used -- exploit_record.schema.json's own case_id has no character-restricting pattern (only minLength:1), so a wider charset here would let a case_id of e.g. '..' produce a schema-valid recording_ref ('evals/recordings/../') that resolves OUTSIDE evals/recordings/ entirely (sec-audit, issue #77 review). This charset structurally excludes '.', so '..' can never validate."
    }
  },
  "if": { "properties": { "severity": { "const": "critical" } } },
  "then": { "properties": { "requires_human_gate": { "const": true } } }
}
