{
  "schema_version": "1.0.0",
  "report_id": "VULN-0003",
  "exploit_id": "EXP-0003",
  "severity": "critical",
  "clinical_impact": "A clinician can be shown medication/allergy/lab information that is stale or contradicts the source record, while the platform marks it verified.",
  "observed": "detect() returned vulnerable=True, label='topically_irrelevant_source_ref_verified'",
  "expected": "detect() returns vulnerable=False (guard holds)",
  "remediation": "Extend verification to check a cited record's own status/relevance, not just its provenance: a citation to a discontinued/inactive record must not back a 'currently taking/on' claim as verified.",
  "fix_validation_status": "not_validated",
  "requires_human_gate": true,
  "filed_at": "2026-07-22T05:53:19Z",
  "approved_at": "2026-07-22T06:01:56Z",
  "approved_by": "owner"
}